{
  "id": "op:producer:finca-ejemplo-huila",
  "type": "Producer",
  "name": "Finca Ejemplo",
  "alternateNames": ["Fca. Ejemplo", "Ejemplo Family Farm"],
  "kind": "family",
  "location": { "country": "CO", "subdivision": "CO-HUI", "region": "Huila", "locality": "Pitalito" },
  "farms": [
    {
      "id": "op:farm:finca-ejemplo-la-loma",
      "name": "La Loma",
      "location": {
        "country": "CO", "subdivision": "CO-HUI", "region": "Huila",
        "coordinates": { "lat": 1.85, "lon": -76.05, "visibility": "approximate" }
      },
      "elevation": { "min": 1750, "max": 1900 },
      "coffeeAreaHectares": 4.5,
      "varietiesGrown": [{ "name": "Pink Bourbon" }, { "name": "Caturra", "wcrName": "Caturra" }]
    }
  ],
  "selfDescribed": {
    "ownership": ["woman-owned", "family-owned", "smallholder"],
    "story": "Somos una familia de tercera generación en Pitalito. Ejemplo ficticio para la especificación.",
    "storyLang": "es",
    "visibility": "public"
  },
  "contact": { "whatsapp": "+57 300 000 0000", "visibility": "permissioned" },
  "thirdPartyIds": [
    { "scheme": "gcds", "value": "EXAMPLE-FARMER-0001" },
    { "scheme": "importer", "issuer": "Example Importers", "value": "HUI-EJ-01" }
  ],
  "provenance": { "source": "Finca Ejemplo", "sourceType": "producer", "assertedAt": "2026-10-18T12:00:00Z", "method": "self-reported" }
}
